{   
    "$schema": "http://json-schema.org/draft-07/schema#",
    "$id": "id",
    "title": "echemdb metadata schema",
    "description": "This is the schema providing metadata of electrochemical measurements hosted on the echemdb website.",
    "not":
    {
        "comment": "This is preload of 'grandchild' dependencies. It is required due to the jsonschema lib issues. See https://github.com/Julian/jsonschema/issues/398.",
        "anyOf":
        [
            { "$ref": "file:electrochemical_system/component.json" },
            { "$ref": "file:electrochemical_system/electrode.json" }
        ]
    },
    "type": "object",
    "properties": {
      "source": {"$ref": "https://raw.githubusercontent.com/echemdb/metadata-schema/main/schemas/source.json"},
      "curation": {"$ref": "file:curation.json"},
      "figureDescription": {"$ref": "file:figure_description.json"},
      "electrochemicalSystem": {"$ref": "file:electrochemical_system.json"}
    }
}
